{
  "schema_version": 1,
  "run_id": "20260713T024731Z-a0a69799",
  "experiment_id": "onboarding-smoke",
  "status": "failed",
  "started_at": "2026-07-13T02:47:33.211253+00:00",
  "ended_at": "2026-07-13T02:47:33.278208+00:00",
  "duration_seconds": 0.072193,
  "command": [
    "C:\\Users\\asus\\anaconda3\\python.exe",
    "src/run.py"
  ],
  "exit_code": 0,
  "git_revision": "4270a98e505f0652b08df4752549cc616925af38",
  "manifest_sha256": "3752bedc70ae43f90e3c3292f5dcf93eb004507b62c614ed7cb9d704b35f6c93",
  "environment_sha256": "7d36f7c051b33a60d85f19db8c32bc503878beaa520d23a8f5e34840ad74fc25",
  "inputs": [
    {
      "path": "templates/experiment/",
      "exists": false,
      "sha256": null,
      "bytes": null,
      "kind": null
    },
    {
      "path": "experiments/framework-onboarding/",
      "exists": false,
      "sha256": null,
      "bytes": null,
      "kind": null
    }
  ],
  "artifacts": [
    {
      "path": "artifacts/validation.json",
      "exists": true,
      "sha256": "09728bba24ba820e7461e6746a691a1cd35d43086dd1df6eefc7535bcc5ebfa2",
      "bytes": 207,
      "kind": "file"
    }
  ],
  "lineage": {
    "path": "experiments/onboarding-smoke/records/20260713T024731Z-a0a69799/lineage.json",
    "sha256": "824bd8aae60ab04987d66e9c35e05c16a64e3781932ddf3fe76dd6227ff30a4d",
    "validation": {
      "status": "not_validated_no_pinned_schema",
      "schema": null
    }
  }
}
