{
  "schema_version": 1,
  "run_id": "20260712T174125Z-4866db92",
  "experiment_id": "linear-demo",
  "status": "succeeded",
  "started_at": "2026-07-12T17:41:26.122943+00:00",
  "ended_at": "2026-07-12T17:41:26.173085+00:00",
  "duration_seconds": 0.056888,
  "command": [
    "C:\\Users\\asus\\AppData\\Local\\Programs\\Python\\Python313\\python.exe",
    "src/run.py"
  ],
  "exit_code": 0,
  "git_revision": "aa398ebdc13d5cb8d44cc83c5e097faade766da3",
  "manifest_sha256": "f8b003c05f58a30f533258af993b7a6576157b0d35583ccf69f588aac4c82e98",
  "environment_sha256": "042105a3b90b510afe67e5d46eb24c3d97f651bb54079e5c94baf90ef264bea3",
  "inputs": [
    {
      "path": "data/raw/points.csv",
      "exists": true,
      "sha256": "ae91c9cff27f1c5976c2c46b33cfb9954f4a7cfbf8a8c67943d7b36b8310383a",
      "bytes": 21,
      "kind": "file"
    }
  ],
  "artifacts": [
    {
      "path": "artifacts/results.json",
      "exists": true,
      "sha256": "ff49a4c74d032464a351d7693c9714d960888662635b532658bf483cbde27328",
      "bytes": 155,
      "kind": "file"
    },
    {
      "path": "artifacts/fit.svg",
      "exists": true,
      "sha256": "30f1bdc4e2c0c9b608850915598e0521c71462a30a856ffdd637b41f35876ee3",
      "bytes": 598,
      "kind": "file"
    }
  ],
  "lineage": {
    "path": "experiments/linear-demo/records/20260712T174125Z-4866db92/lineage.json",
    "sha256": "9c07b3ce6871691b9bc1fd09761a0b7839ffc64e9c931004e7f351a2e275e0e2",
    "validation": {
      "status": "valid",
      "schema": "schemas/lineage.schema.json"
    }
  }
}
