{
  "schema_version": 1,
  "run_id": "20260713T030445Z-c91f6c48",
  "experiment_id": "onboarding-smoke",
  "status": "failed",
  "started_at": "2026-07-13T03:04:47.061413+00:00",
  "ended_at": "2026-07-13T03:04:47.135519+00:00",
  "duration_seconds": 0.081023,
  "command": [
    "C:\\Users\\asus\\anaconda3\\python.exe",
    "src/run.py"
  ],
  "exit_code": 0,
  "git_revision": "4270a98e505f0652b08df4752549cc616925af38",
  "manifest_sha256": "3752bedc70ae43f90e3c3292f5dcf93eb004507b62c614ed7cb9d704b35f6c93",
  "environment_sha256": "7d36f7c051b33a60d85f19db8c32bc503878beaa520d23a8f5e34840ad74fc25",
  "inputs": [
    {
      "path": "templates/experiment/",
      "exists": false,
      "sha256": null,
      "bytes": null,
      "kind": null
    },
    {
      "path": "experiments/framework-onboarding/",
      "exists": false,
      "sha256": null,
      "bytes": null,
      "kind": null
    }
  ],
  "artifacts": [
    {
      "path": "artifacts/validation.json",
      "exists": true,
      "sha256": "09728bba24ba820e7461e6746a691a1cd35d43086dd1df6eefc7535bcc5ebfa2",
      "bytes": 207,
      "kind": "file"
    }
  ],
  "lineage": {
    "path": "experiments/onboarding-smoke/records/20260713T030445Z-c91f6c48/lineage.json",
    "sha256": "d5b988cf893aff4b004d721f91f6878ffaf1bc6325ebff90d4dcc8ca4c7f04cb",
    "validation": {
      "status": "valid",
      "schema": "schemas/lineage.schema.json"
    }
  }
}
